id,intel_type,subject,detail,strategic_implication,source,timestamp
55,threat,"Hyderabad Founders Build Clean-Label Organic Food Ecosystem, Asking ...","Hyderabad Founders Build Clean-Label Organic Food Ecosystem, Asking India To Count Chemicals Not Just Calories - Have 60% Repeat Customers Founded in 2025, Frissly is a Hyderabad-based D2C organic product marketplace that offers a wide range of chemical-free food items like savouries, batters, flours, sweets, and snacks.",TOW should monitor and build defensive positioning against this.,https://startuppedia.in/startup-stories/hyderabad-founders-build-clean-label-organic-food-ecosystem-asking-india-to-count-chemicals-not-just-calories-have-60-repeat-customers-10984086,2026-04-16T12:25:04
56,threat,Indian Retailer - How Akshayakalpa Organic's Farmer-Centric Model ...,"Currently, Akshayakalpa Organic's products are available in Bangalore, Chennai, and Hyderabad, with an expanding presence on e-commerce platforms like Amazon and Swiggy.",TOW should monitor and build defensive positioning against this.,https://www.indianretailer.com/interview/retail-people/new-commerce/how-akshayakalpas-farmer-centric-model-achieved-rs30-cr,2026-04-16T12:25:04
57,threat,"Pure, untouched, organic milk from cows raised with care","Certified Organic Milk & other products delivered by 7 AM in Bengaluru, Chennai, and Hyderabad. 100% natural, 69% of you pay goes to farmers.",TOW should monitor and build defensive positioning against this.,https://akshayakalpa.org/,2026-04-16T12:25:04
58,threat,24 Mantra Organic,"Discover 24 Mantra Organic , certified organic foods. Shop now for pure, healthy, and sustainable choices—pure by nature!",TOW should monitor and build defensive positioning against this.,https://24mantraorganic.com/,2026-04-16T12:25:18
59,threat,"24 Mantra Organic Farm Shop, Ahmed Nagar, Masab Tank, Hyderabad ...","Latest 24 Mantra Organic Farm Shop coupons, offers & promo codes for Apr 2025. All offers & coupons verified today. Get additional bank discounts and offers.",TOW should monitor and build defensive positioning against this.,https://magicpin.in/Hyderabad/Ahmed-Nagar/Restaurant/24-Mantra-Organic-Farm-Shop/store/42513c/vouchers/,2026-04-16T12:25:18
60,threat,Amazon.in: 24 Mantra Organic: Amazon Fresh,"24 Mantra Organic Raw Peanut, 500g Options: 4 sizes, 3 flavours 3,861 2K+ bought in past month Save 19% Price, product page₹138(₹27.60/100 g)M.R.P: ₹170 M.R.P: ₹170 (19% off) Up to 5% back with Amazon Pay ICICI card FREE delivery starting from Today 3 pm - 7 pm on orders over ₹499 0 in cart",TOW should monitor and build defensive positioning against this.,"https://www.amazon.in/Amazon-Fresh-24-Mantra-Organic/s?rh=n:16392737031,p_89:24+Mantra+Organic",2026-04-16T12:25:18
61,threat,24 Mantra Organic Deals Discounts Stores | Organic Food Pesticide Free,"24 Mantra Organic is the largest Indian organic food brand in India. It has over 200 products internationally certified sold in the US and international markets. Switch to organic food, pesticide free meat, chicken, breakfast, vegetables today. Check out 24 Mantra deals, discounts & Coupons.",TOW should monitor and build defensive positioning against this.,https://www.upto75.com/24-mantra-organic-food-discount-offers,2026-04-16T12:25:18
62,threat,24 Mantra Organic - bigbasket,Best online 24 Mantra Organic products shop in India. Find a variety of 24 Mantra Organic products at best prices online.,TOW should monitor and build defensive positioning against this.,https://www.bigbasket.com/pb/24-mantra-organic/,2026-04-16T12:25:18
63,threat,24 Mantra Organic - Facebook,"24 Mantra Organic. 97,210 likes · 4 talking about this · 3 were here. 100% Organic, Truly Ghar Ka Khana With No Pesticides & No Chemicals Upgrade to 24 Mantra Organic.",TOW should monitor and build defensive positioning against this.,https://www.facebook.com/24MantraOrganic/,2026-04-16T12:25:18
64,threat,The Next Wave of Natural & Organic Grocery Expansion...,"Natural and organic grocery is entering a new growth cycle, marked by specialty players pushing into new geographies, premium grocers expanding into urban markets, and big-box retailers treating wellness as a core platform rather than a niche aisle.",TOW should monitor and build defensive positioning against this.,https://www.mcmillandoolittle.com/the-next-wave-of-natural-organic-grocery-expansion/,2026-04-16T12:25:23
65,threat,Organic Grocery Price & Availability Tracking Case Study,"By monitoring competitor prices, stock levels, and promotions, the brand improved.24Mantra Organic track real-time SKU-level pricing and availability Organic Grocery Price & Availability Tracking Competitive Intelligence for Organic Grocery Brands.",TOW should monitor and build defensive positioning against this.,https://www.socialwebmarks.com/organic-grocery-price-availability-tracking-case-study-actowiz/,2026-04-16T12:25:23
66,opportunity,Indian government lays out action plan to promote millet export,"... millets and value-added millet products in the international market in association with ICAR-Indian Institute of Millets Research (IIMR), Hyderabad, ...",TOW can act on this to grow market share in Hyderabad.,https://www.prokerala.com/news/articles/a1362772.html,2026-04-16T12:25:56
67,opportunity,Why Millet Processing Tech Needs Rapid Innovation - FFOODS,"One of the standout examples of this transition is Hyderabad-based startup Troo Good, which has scaled its millet chikki production to an astounding ...",TOW can act on this to grow market share in Hyderabad.,https://nuffoodsspectrum.in/2025/08/01/why-millet-processing-tech-needs-rapid-innovation.html,2026-04-16T12:25:56
68,opportunity,Pin by Designs by S & K LLC on Zero waste store | Zero waste...,"Organic Food Store Exterior. Zero Waste Store Interior.Description. The ultimate zero-waste grocery shopping guide will teach you how to shop package free in your local store, what to bring and how not to pay extra for bringing your own container.",TOW can act on this to grow market share in Hyderabad.,https://www.pinterest.com/pin/835699274581330362/,2026-04-16T12:26:26
69,opportunity,What if the Musi River could lead the development of Hyderabad?,"Café Paaka, Hyderabad: ‘Organic, artisanal, slow’. To promote underground independent arts, to provide a platform for such artists and to expose the crowd to a variety of alternative genres.How a zero-waste store can actually substitute conventional departmental stores.",TOW can act on this to grow market share in Hyderabad.,https://vikalpsangam.org/article/what-if-the-musi-river-could-lead-the-development-of-hyderabad/,2026-04-16T12:26:26
70,opportunity,Organic - Grocery Store HTML Website Template,Varieties in Organic Mango. 100+. Happy Customers. 10+. Store Locations. Fresh from farm.Call us at : +91 99480 58638. phone. Delivery can be processed through Porter APP with in the Hyderabad City.,TOW can act on this to grow market share in Hyderabad.,https://mmorganicmangoes.com/,2026-04-16T12:26:26
71,threat,This Hyderabad-based organic food brand works with 45... | YourStory,"24 Mantra Organic works with over 45,000 farmers to produce kitchen staples, packaged food, and beverages, and serves over a million customers in India an.",TOW should monitor and build defensive positioning against this.,https://yourstory.com/smbstory/24-mantra-organic-food-fmcg-farmers-hyderabad-business-entrepreneur,2026-04-16T12:35:25
72,customer_pain_point,The Affordable Organic Store - not sent my order,"Consumer complaints, reviews and opinions about The Affordable Organic Store - not sent my order. Share your experience, submit a complaint for The Affordable Organic Store - not sent my order",TOW can differentiate by directly solving this pain point.,https://www.complaintlists.com/the-affordable-organic-store-not-sent-my-order/,2026-04-16T12:35:46
73,customer_pain_point,"Organic Mart (Om) Reviews, Gulmohar Park Colony-Serilingampally ...","Organic Mart (Om) in Gulmohar Park Colony-Serilingampally, Hyderabad currently holds an average rating of 5.0 based on user reviews. Checking reviews before visiting or availing services is always helpful, as it gives you access to real customer perspectives. While opinions may vary, they still offer useful insight into what you can expect.",TOW can differentiate by directly solving this pain point.,https://www.justdial.com/Hyderabad/Organic-Mart-Om-Gulmohar-Park-Colony-Serilingampally/040PXX40-XX40-251129213353-V5H7_BZDET/reviews,2026-04-16T12:35:46
74,threat,Blinkit: Groceries & more – Apps on Google Play,"Blinkit is India’s last minute app. Trusted by millions, it is your everyday online grocery shopping app that home-delivers 30,000+ products & groceries.",TOW should monitor and build defensive positioning against this.,https://play.google.com/store/apps/details?id=com.grofers.customerapp&hl=en_IN,2026-04-16T12:37:16
75,threat,"Organic Vegetables, Fruits, Staples - OrganicSiri Farms","100% trusted organic vegetables, fruits, grains, millets, oils - proudly produced in our own certified farms. Order online, we deliver organic food in Hyderabad.",TOW should monitor and build defensive positioning against this.,https://organicsiri.com/,2026-04-16T12:37:21
76,threat,Organic Online Store|Grocery |Vegetables|Dairy Products|Fruits ...,"Order organic farm fresh fruits, vegetables, dairy products, exotic veggies, grocery home delivery. we ensure you have the highest quality fresh farm products when you need it at your door step. we have the best app for online grocery delivery near you in Hyderabad.",TOW should monitor and build defensive positioning against this.,https://organicsmantra.in/,2026-04-16T12:37:21
77,threat,Manapolam - Best Fruits and Vegetable Vendors in Hyderabad,"In today's fast-paced world, it is really difficult to find a convenient method to stay healthy. But, thanks to technology today, you can get farm-fresh organic products directly to your home. Yes, you read that correctly! With Manapolam, you can now enjoy your favourite fruits and vegetables without stepping out of your home. We take pride in being one of the best online fruit and vegetable ...",TOW should monitor and build defensive positioning against this.,https://manapolam.in/,2026-04-16T12:37:21
78,threat,"Sree Vaaraahi Farms - Organic Vegetables, Fruits, Groceries and Meat ...","Sree Vaaraahi Farms is dedicated to providing a lifeline of pure, organic goodness to 5000 Hyderabad residents on their path to recovery. Our mission is to cultivate and deliver the finest, freshest produce, ensuring those in need receive the nourishment they deserve. Experience the transformative power of nature's healing touch.",TOW should monitor and build defensive positioning against this.,https://www.sreevaaraahifarms.in/,2026-04-16T12:37:21
79,threat,Satvik Organic Case Study | Organic Grocery Mobile AppOrganicStore.inRecommendations AI | Google CloudWelcome To The Org,The organic food retail sector is one of the fastest-growing sectors across the world. Many countries are increasing their interest to grow with the organic production and sell in the market. India is the top third country with the largest wild harvest area of 4.2 million for organic products. It also houses the highest number of organic producers ... See full list on webkul.com Satvik organic started its journey in 2011 from the traditional market where people use to buy organic products physic,TOW should monitor and build defensive positioning against this.,https://webkul.com/blog/case-studies/satvik-organic-food-mobile-app/,2026-04-16T12:37:28
80,threat,OrganicStore.in,"Discover a wide range of certified organic groceries, natural wellness products, Ayurvedic remedies, and chemical-free organic cosmetics — all carefully curated from trusted farmers and verified brands.",TOW should monitor and build defensive positioning against this.,https://www.organicstore.in/,2026-04-16T12:37:28
81,threat,"Amazon.com : 24 Mantra Organic Masoor Dal - 4 lbs, (Pack of...)","Product details. Brand. 24 Mantra Organic. Item Weight.EU Organic production is an overall system of farm management and food production that combines environmental practices, the preservation of natural resources and the application of animal welfare standards.",TOW should monitor and build defensive positioning against this.,https://www.amazon.com/24-Mantara-Mantra-Organic-Masoor/dp/B00V2GC8TM,2026-04-16T12:37:36
82,threat,24 Mantra Organic Products - HealthyHappyOrganic Hub Pvt Ltd.,"24 Mantra Organic Organic Raw Peanut/Kadalekayi|500 g.You can pause/edit/cancel anytime. Product DescriptionDiscover the rich and vibrant flavors of our Hot Mixture, a carefully crafted blend of spices and herbs designed to elevate your dishes to a new level. Perfect for cooking...",TOW should monitor and build defensive positioning against this.,https://h2ohub.com/24-mantra-organic-1/,2026-04-16T12:37:36
83,threat,"24 Mantra Organic Salted Peanuts > Organic Ready to Eat, Ready to...","USDA Certified Organic, India Organic, EU Organic Certified Purchasing Organic means: no pesticides no chemicals no artificial interventions environmentally friendly: keeps chemicals and pesticides out of the air, water, soil and our bodies farmers enjoy happier lives Product of...",TOW should monitor and build defensive positioning against this.,https://www.ishopindian.com/24-Mantra-Organic-Salted-Peanuts,2026-04-16T12:37:36
84,threat,ITC bets big on organic food market with 24 Mantra,"The organic packaged food segment in India has gained momentum with the entry of large FMCG players like ITC and Tata Consumer Products Ltd. ITC, which recently acquired Hyderabad-based 24 Mantra ...",TOW should monitor and build defensive positioning against this.,https://www.newindianexpress.com/business/2025/Nov/29/itc-bets-big-on-organic-food-market-with-24-mantra,2026-04-16T12:37:41
85,threat,India's Organic Food Market to Reach $8.9 Bn by 2032 at a 21.19 pc CAGR ...,"Organic grocery stores saw a 25 percent increase in searches, with Hyderabad, Mumbai, Chennai, Bangalore, and Delhi being the top cities for these queries. Organic product dealers saw a 13 percent increase in searches, with Chennai emerging as the leading city for these searches.",TOW should monitor and build defensive positioning against this.,https://www.indianretailer.com/article/retail-business/retail-trends/indias-organic-food-market-reach-89-bn-2032-2119-pc-cagr,2026-04-16T12:37:41
86,threat,"India Organic Food Market Size, Share, Trend, Industry Report","The fruits segment remains the largest contributor to the organic foods market in India. Vegetables are emerging as the fastest-growing segment, reflecting changing consumer preferences. Supermarkets continue to dominate organic food sales, while online retail is rapidly gaining traction. Rising demand for organic products and government initiatives are key drivers propelling market growth.",TOW should monitor and build defensive positioning against this.,https://www.marketresearchfuture.com/reports/india-organic-food-market-20704,2026-04-16T12:37:41
87,threat,Organic Food in Hyderabad - Latest Price & Mandi Rates from Dealers in ...,"Find here details of companies selling Organic Food in Hyderabad, Telangana. Get latest info on Organic Food, suppliers, wholesale suppliers, retailers & traders with Organic Food prices for buying.",TOW should monitor and build defensive positioning against this.,https://m.indiamart.com/hyderabad/organic-food.html,2026-04-16T12:37:41
88,threat,11 Best Organic Food Stores In Hyderabad - Stylecraze,"Searching for organic food stores in Hyderabad? Check out these 10 stores that provide fresh, healthy, and chemical-free fruits, vegetables, and other products.",TOW should monitor and build defensive positioning against this.,https://www.stylecraze.com/articles/best-organic-food-stores-in-hyderabad/,2026-04-16T12:37:41
89,threat,"PDF Analysis of retailing and competitor scenario of organic Onion, Ginger ...","The retail format that supports Hyderabad organic food market which has a large number of retail locations including supermarkets, hypermarkets, farmer markets, exclusive organic stores and online ...",TOW should monitor and build defensive positioning against this.,https://www.researchgate.net/profile/Nirmala-Bandumula/publication/374674130_International_Journal_of_Statistics_and_Applied_Mathematics_2023_SP-85_752-755_Analysis_of_retailing_and_competitor_scenario_of_organic_Onion_Ginger_and_Garlic_in_Hyderabad_city_of_Telangana/links/6528dd422e1ba453041e6d6b/International-Journal-of-Statistics-and-Applied-Mathematics-2023-SP-85-752-755-Analysis-of-retailing-and-competitor-scenario-of-organic-Onion-Ginger-and-Garlic-in-Hyderabad-city-of-Telangana.pdf,2026-04-16T12:37:41
90,opportunity,Hyderabad's first no plastic 'Zero Waste Eco-store' - ETV Bharat,"Pankaj, a chartered accountant by profession has opened the first 'Zero Waste Eco-store' in Hyderbad with the idea of reducing the usage of plastic waste in our everyday lives. The store not only promotes non-plastic packaging materials but also encourages customers to use organically-made products, which are also available at the store.",TOW can act on this to grow market share in Hyderabad.,https://www.etvbharat.com/english/city/hyderabad/meet-the-owner-of-first-zero-waste-eco-store-in-hyderabad/na20200202070328123,2026-04-16T12:38:47
91,opportunity,"Zero Waste Eco Store, Karkhana, Hyderabad - Justdial","Established in the year 2020, Zero Waste Eco Store in Karkhana,Hyderabad listed under Organic Grocery Stores in Hyderabad. Rated 4.4 based on 182 Customer Reviews and Ratings with 21 Photos. Visit Justdial for Address, Contact Number, Reviews & Ratings, Photos, Maps of Zero Waste Eco Store, Karkhana, Hyderabad.",TOW can act on this to grow market share in Hyderabad.,https://www.justdial.com/Hyderabad/Zero-Waste-Eco-Store-Near-Hdfc-Bank-Karkhana/040PXX40-XX40-191228072710-N4F6_BZDET,2026-04-16T12:38:47
92,opportunity,"PDF Dr. Shweta B. Karadipatil, 2025, 13:5 An Open Access Journal ...","Abstract- The study critically analyses three prominent Indian agri-business firms—EcoFarms India Ltd., Sresta Natural Bioproducts (24 Mantra Organic), and WayCool Foods—to evaluate their adoption of green and sustainable practices across production, processing, and supply chains. Using a comparative case study methodology, the paper examines environmental, social, and economic indicators ...",TOW can act on this to grow market share in Hyderabad.,https://www.ijset.in/wp-content/uploads/IJSET_V13_issue5_152.pdf,2026-04-16T12:38:52
93,opportunity,"ITC Acquisition: ITC to acquire 24 Mantra Organic, ETBrandEquity","The Indian government has been actively promoting the organic foods industry through various schemes and initiatives, aiming to improve the livelihoods of farmers, boost exports, enhance packaging ...",TOW can act on this to grow market share in Hyderabad.,https://brandequity.economictimes.indiatimes.com/news/marketing/itc-to-acquire-24-mantra-organic/120388110,2026-04-16T12:38:52
94,opportunity,Retail Store Carbon Impact Calculator - Royalafrican Foundation,"The retail carbon footprint calculator includes store operations (energy, refrigeration, lighting), supply chain logistics (deliveries, inventory, sourcing), customer impact (travel, packaging, shopping bags), and operational overhead across all retail categories from fashion to grocery to electronics.",TOW can act on this to grow market share in Hyderabad.,https://www.royalafrican.org/retail-store-carbon-impact-calculator/,2026-04-16T12:38:57
95,threat,Hyderabad takes to organic foods | Hyderabad takes to organic foods,"Hyderabad: The demand for organic food products has been rising steadily in the city, with a 48 per cent increase since 2011. In fact, the city is in strong competition with Bengaluru, which was once much ahead of Hyderabad.",TOW should monitor and build defensive positioning against this.,https://www.deccanchronicle.com/140911/nation-current-affairs/article/hyderabad-takes-organic-foods-0,2026-04-16T13:00:47
96,threat,Organic Grocery Store Options In... - Naperville Fresh Market,"Do organic pantry items store differently? Storage is largely the same, but freshness still matters. Keep grains and flours in airtight containers away from heat and light, and rotate stock regularly.",TOW should monitor and build defensive positioning against this.,https://napervillefreshmarket.com/grocery/organic-grocery-store-options-in-naperville-illinois-5/,2026-04-16T13:00:47
97,threat,Making Grocery Store Open Toilet | TikTok,New Store Opening. Grocery Store Candid. Grand Opening for Restaurant.Follow along to see us open a simple/local/organic grocery store with 4 kids along for the ride. #smallbusiness #openbusinesses #entrepreneur #familythings #couplegoals #diy #family #familytime.,TOW should monitor and build defensive positioning against this.,https://www.tiktok.com/discover/making-grocery-store-open-toilet,2026-04-16T13:00:47
98,threat,"Top Organic Grocery Store Near Me | Fruit and veg shop, Organic...","Looking for the top organic grocery store near you? Shop for the freshest organic fruits, vegetables, grains, and dairy products at unbeatable prices. Our store is dedicated to providing high-quality, chemical-free, and sustainably sourced groceries to support your healthy lifestyle.",TOW should monitor and build defensive positioning against this.,https://www.pinterest.com/pin/top-organic-grocery-store-near-me--30680841208059188/,2026-04-16T13:00:47
99,threat,Organic & Natural food store | Sprouts Farmers Market,"Experience the convenience of Sprouts Farmers Market with nationwide store locations offering a variety of fresh organic & natural food store.Visit Sprouts Farmers Market in California or order from the Sprouts app for healthy, affordable groceries when you need them most.",TOW should monitor and build defensive positioning against this.,https://www.sprouts.com/stores/,2026-04-16T13:00:47
100,customer_pain_point,Organic Natural Vegetables Online Home delivery in Hyderabad from ...,Our Vegetables are grown Naturally & Organically at Our Own Farms in Aushapur & Zaheerabad in Telangana State.,TOW can differentiate by directly solving this pain point.,https://www.pracheena.com/categories/vegetables/825678000000299087,2026-04-16T13:01:30
101,threat,Empowering Indian Retail with AI: Personalization at Scale,"For example, Flipkart and Amazon India use AI-powered recommendation engines that anticipate consumer preferences, turning casual browsers into loyal buyers. This level of personalization not only satisfies customers but also fuels conversion rates-much like a store attendant who knows exactly what a customer wants before they do.",TOW should monitor and build defensive positioning against this.,https://navikenz.com/empowering-indian-retail-with-ai-personalization-and-innovation-at-scale/,2026-04-16T13:03:04
102,threat,Free classifieds in India - Bharuch - free classified ads,"Pure Organic Honey is a healthy, natural sweetener made from raw, unprocessed honey. ... Transform your business operations with our state-of-the-art ...",TOW should monitor and build defensive positioning against this.,https://bharuch.indads.in/,2026-04-16T13:03:14
103,threat,Privilege Membership Gold Card - Orgalife,"One of the best organic and natural food products online store in India brought directly from farmers, offering various health benefits.",TOW should monitor and build defensive positioning against this.,https://orgalife.in/products/best-organic-product-gold-membership-in-india,2026-04-16T13:03:22
104,threat,Top Organic Grocery Stores in Hyderabad - Best Organic Provisional Store near me - Justdial,"Open until 11:00 pm · Show NumberOrder onlineBook a table · + 145 More · 4.1 · 615 Ratings · Road No 12 Banjara Hills, Hyderabad · Packaged Organic Food Retailers · Grocery Stores · Show Number ·",TOW should monitor and build defensive positioning against this.,https://www.justdial.com/Hyderabad/Organic-Grocery-Stores/nct-11614155,2026-04-16T16:41:16
105,threat,The Organic World set to grow e-commerce footprint,It plans on achieving a target ... and operated stores as part of its ongoing expansion strategy. The Organic World eyes adding 30 stores in Hyderabad by 2025 end...,TOW should monitor and build defensive positioning against this.,https://theorganicworld.com/news-details/12,2026-04-16T16:41:16
106,threat,Organic food store in hyderabad sampangi naturals,"March 24, 2025 - March 24, 2025 · 0 Comments · Views 3812 · Organic Food Store in Hyderabad Sampangi Naturals give your family the goodness of real, natural ingredients Welcome to Sampangi Naturals Hyderabad’s most trusted 100% natural food destination, ...",TOW should monitor and build defensive positioning against this.,https://www.sampanginaturals.com/organic-food-store-in-hyderabad/,2026-04-16T16:41:16
107,customer_pain_point,Thoughts on Organic World Franchise : r/bangalore - Reddit,"Lately I had been targeted by an ad to start a franchise store for the organic world in Bangalore, I don't have a lot of money but I am surely interested to start a business, has anyone explored this or atleast shopped at a store?",TOW can differentiate by directly solving this pain point.,https://www.reddit.com/r/bangalore/comments/1b6fsxa/thoughts_on_organic_world_franchise/,2026-04-16T16:41:49
108,customer_pain_point,Top Grocery Stores in Hyderabad - Best Grocery Shops near me - Justdial,"41917 Grocery Stores in Hyderabad. Find Grocery Shops, Doorstep Grocery Delivery, Grocery Home Delivery, Grocery Supermarkets in Hyderabad. Get Phone Numbers, Address, Reviews, Photos, Maps for top Grocery Stores near me in Hyderabad on Justdial.",TOW can differentiate by directly solving this pain point.,https://www.justdial.com/Hyderabad/Grocery-Stores/nct-10237947,2026-04-16T16:41:53
