id,intel_type,subject,detail,strategic_implication,source,timestamp
109,threat,Boosting Organic Grocery Sales: Online Meets Offline,Integrate your loyalty program with your online and in-store channels. Customers should be able to earn and redeem rewards whether they're shopping online or in-store. This creates a seamless and consistent experience across all your channels.,TOW should monitor and build defensive positioning against this.,https://answell.org/blog/boosting-organic-grocery-sales-online,2026-04-16T16:43:15
110,threat,Tatas look for foothold in cut-throat online grocery retail market,"While competition in the Indian online grocery retailing market has been growing for some time, 2020 has brought with it a renewed intensity. First, Reliance Retail launched its JioMart venture. Now, news reports suggest the Tata group is in talks to buy a stake in online grocer BigBasket.",TOW should monitor and build defensive positioning against this.,https://www.livemint.com/market/mark-to-market/rivalry-heats-up-in-online-grocery-retailing-market-11603068711931.html,2026-04-16T16:43:37
111,threat,News details,The residents of Hyderabad can ... living more accessible to consumers across India’s retail landscape. The Organic World eyes adding 30 stores in Hyderabad by 2025 end...,TOW should monitor and build defensive positioning against this.,https://theorganicworld.com/news-details/1,2026-04-16T21:06:16
112,threat,Top 50 Organic Food VC (Venture Capital) Funds in India in July 2025 — Jul 2025,"SMEClabs — Course in Data Science & AI, Python, Automation PLC Sap Training, Embedded, Oil & Gas NDT, MEP, BMS, Kochi, Thiruvananthapuram, Calicut, Kerala, Chennai, Bangalore, Hyderabad, Mumbai · Jeevanksh.com — Jeev Anksh Eco Products is a social enterprise and is in the business of marketing healthy, organic and eco-friendly products since 2012.The company is a DIPP, Govt. of India, recognised startup, under Startup India initiative, with recognition no.",TOW should monitor and build defensive positioning against this.,https://shizune.co/investors/organic-food-vc-funds-india,2026-04-16T21:06:25
113,threat,Top 50 Organic Food Startup Investors in India in January 2026 — Jan 2026,"Rohit Bhojaraj Angel · Hyderabad, Andhra Pradesh, India · Dr. Rohit Bhojaraj is the Chief Operating Officer at Rainbow Children's Hospitals. Show more ... Wildermart — Discover curated healthy & sustainable products sourced locally from the makers in Bangalore. Get clean alternatives to everyday grocery purchases ranging from certified organic staples, fruits & vegetables, preservative-free packaged foods, natural personal and home care.",TOW should monitor and build defensive positioning against this.,https://shizune.co/investors/organic-food-investors-india,2026-04-16T21:06:25
114,threat,Best Organic Food Franchise Opportunities in India,"August 23, 2025 - It is one of the best-known organic food brands in India, with more than 200 products across categories. Founded: 2004 Model: Retail, distribution, and export Investment Range: ₹25–50 lakhs USP: Pan-India presence, robust supply chain, certified farms · An organic store located in Hyderabad that sells fresh produce, grocery items, and environment-friendly products.",TOW should monitor and build defensive positioning against this.,https://www.franchiseindia.com/insights/en/article/best-organic-food-franchise-opportunities-in-india.57259,2026-04-16T21:06:25
115,customer_pain_point,Which is the best organic store in Hyderabad? - Quora,"Answer (1 of 4): You can buy organic vegetables, fruits, groceries and other non-toxic cookware online at: https://backtorootsorganicstore.com/ Back To Roots Organic store also has 2 offline store. One at Kondapur ( botanical garden - masjid banda road ) and the other at Nallagandla.",TOW can differentiate by directly solving this pain point.,https://www.quora.com/Which-is-the-best-organic-store-in-Hyderabad,2026-04-16T21:06:46
116,customer_pain_point,"If You're Looking For Organic Stores In Hyderabad, Check These Out | LBB","October 20, 2025 - Are you opting for an all things organic lifestyle? Organic India, which is a popular wellness brand has opened its first store in Banjara Hills. Check out the spices or pasta, quinoa along with honey, ghee, and pulses. With more than 10 varieties of tea that include caffeine-free, you can, in fact, pick a tea to solve an ailment.",TOW can differentiate by directly solving this pain point.,https://lbb.in/hyderabad/organic-stores-hyderabad/,2026-04-16T21:06:46
117,customer_pain_point,Top Organic Food Retailers in Hyderabad - Best Whole Food Market near me - Justdial,"1083 Organic Food Retailers in Hyderabad. Find ✓ Whole Food Market, ✓Ecological Food, ✓Health Food Stores, ✓Natural Food in Hyderabad. Get Phone Numbers, Address, Reviews, Photos, maps for Top Organic Food Retailers near me in Hyderabad on Justdial.",TOW can differentiate by directly solving this pain point.,https://www.justdial.com/Hyderabad/Organic-Food-Retailers/nct-10344576,2026-04-16T21:06:46
118,customer_pain_point,Contact Us – Organic India,"We will make every effort to provide a resolution. To get in touch you can: Call us 18001084488 (From 10 AM to 7 PM, Monday to Saturday) Email us , care@tataconsumer.com For International Business - export@organicindia.com",TOW can differentiate by directly solving this pain point.,https://organicindia.com/pages/contact-us,2026-04-16T21:06:46
119,customer_pain_point,"Organic And Organic Reviews, Tarnaka, Hyderabad - 66 Ratings - Justdial","Reviews for Organic And Organic, Tarnaka, Hyderabad. Unbiased, genuine user reviews, ratings and experience for Organic And Organic, Tarnaka on Justdial",TOW can differentiate by directly solving this pain point.,https://www.justdial.com/Hyderabad/Organic-And-Organic-Opposite-Tarnaka-Welfare-Association-Tarnaka/040PXX40-XX40-181108120840-B4T1_BZDET/reviews,2026-04-16T21:06:46
120,customer_pain_point,Our Organic Food Delivery in Hyderabad - Prompt & Protected - OrganicSiri Farms,"May 8, 2025 - For locations outside Hyderabad and Secunderabad, we are currently unable to deliver. We understand your interest in healthy food delivery and endeavor to expand as soon as we can. We do not have any physical organic stores and here is why.",TOW can differentiate by directly solving this pain point.,https://organicsiri.com/organic-food-delivery/,2026-04-16T21:06:55
121,customer_pain_point,Buy Organic Foods Online | Organic Food Company | Hyderabad – Green Station,Delivering free across Hyderabad on orders above ₹500. Local delivery happens every Wednesday and Saturday. Accepting Out Station orders for non fruits & vegetables products. +91 9701 111 633 support@greenstation.co info@greenstation.co Join ...,TOW can differentiate by directly solving this pain point.,https://www.greenstation.co/,2026-04-16T21:06:55
122,customer_pain_point,Back To Roots Organic Store,"Our hours of operation are Mon-Fri: 10 AM - 7 PM Sat-Sun: 1 PM - 6 PM · Nallagandla, Hyderabad",TOW can differentiate by directly solving this pain point.,https://www.backtorootsorganicstore.com/,2026-04-16T21:06:55
123,threat,'Software as a service' gains traction in Hyderabad -,"... retail (each offline and online), logistics, healthcare, education, aviation, telecom, real property, agriculture, and manufacturing, the consumer ...",TOW should monitor and build defensive positioning against this.,https://jaccblog.com/software-as-a-service-gains-traction-in-hyderabad/,2026-04-16T21:08:35
124,threat,Buyer Jobs in Hyderabad (299 Vacancies) | Jobted India,Performance Media Buyer (Meta & TikTok) B2C Consumer Subscription App (Dating / Social Required) Location: Remote Type: Full-time Reporting to ...,TOW should monitor and build defensive positioning against this.,https://www.jobted.in/buyer-jobs-hyderabad,2026-04-16T21:08:35
125,threat,Amazon.com : 24 Mantara 24 Mantra Organic Dry Ginger Powder...,"Top highlights. Brand. 24 Mantra Organic. Variety. Ginger.Found a lower price? Let us know. Although we can't match every price reported, we'll use your feedback to ensure that our prices remain competitive.",TOW should monitor and build defensive positioning against this.,https://www.amazon.com/24-Mantra-Organic-Ginger-Powder/dp/B008NYCH8I,2026-04-16T21:08:46
126,threat,24 Mantra Organic Ragi Flour 500 g | Basket Hunt,"HomeGroceriesStaplesAtta, Flours & Sooji24 Mantra Organic Ragi Flour 500 g.Vegetarian. Manufacturer. Sresta Natural Bioproducts Pvt Limited.",TOW should monitor and build defensive positioning against this.,https://www.baskethunt.com/p/24-mantra-organic-ragi-flour-500-g/,2026-04-16T21:08:46
127,threat,Organic grocery retailer The Organic World to have 100 stores by 2025,"Organic World expands to 17 stores, aiming to reach 100 by 2025. Mix of COCO and FOMO models; focus on Chennai, Hyderabad. Offers certified organic groceries, dairy, eggs, oils, beauty products ...",TOW should monitor and build defensive positioning against this.,https://www.thehindubusinessline.com/companies/organic-grocery-retailer-the-organic-world-to-have-100-stores-by-2025/article67569848.ece,2026-04-16T21:08:50
128,opportunity,Green Trends Price List Hyderabad: 2025 Eco Product Costs ...,"Apr 3, 2026 · Key trends include rising demand for reusable shopping bags, premium green cardamom, and organic millets, with price variations influenced by product type, certification, and supplier location.",TOW can act on this to grow market share in Hyderabad.,https://www.accio.com/business/green_trends_price_list_in_hyderabad,2026-04-16T21:09:24
129,opportunity,We don't need a handful of... - The Affordable Organic Store,"We don't need a handful of people doing zero waste perfectly. We need millions of people doing it imperfectly. Join us for this initiative. NOW, HOW TO PAY BY PLASTICS? 1. Collect all the plastic and clean it. 2. Send the plastic to this address: The Affordable Organic Store, 7-8-275, Gowtham Nagar, Ferozguda, Hyderabad 50011. 3. Send an email to us with the tracking number of the parcel and ...",TOW can act on this to grow market share in Hyderabad.,https://www.facebook.com/theaffordableorganicstore/posts/we-dont-need-a-handful-of-people-doing-zero-waste-perfectly-we-need-millions-of-/463813882012847/,2026-04-16T21:09:59
130,opportunity,"Adrish Zero Waste Organic Store, Jubilee Hills, Hyderabad - Justdial","Adrish Zero Waste Organic Store in Jubilee Hills,Hyderabad listed under Organic Grocery Stores in Hyderabad. Rated 4.6 based on 106 Customer Reviews and Ratings with 20 Photos. Visit Justdial for Address, Contact Number, Reviews & Ratings, Photos, Maps of Adrish Zero Waste Organic Store, Jubilee Hills, Hyderabad.",TOW can act on this to grow market share in Hyderabad.,https://www.justdial.com/Hyderabad/Adrish-Zero-Waste-Organic-Store-Guttala-Begumpet-Kavuri-Hills-Jubilee-Hills/040PXX40-XX40-210809214639-N3U5_BZDET,2026-04-16T21:09:59
131,opportunity,"Purity Prayag Organic Grocery Store at S.R Nagar, Hyderabad","Purity Prayag promises you of selling only chemical-free & organic products. Our Organic stores comprise 100% organic and natural products, including pesticide-free. Address - 8-3-1109/2, Shop No.2, Subhadra Enclave, Opp: SBI Yellareddyguda Branch, Srinagar Colony Main Road, Hyderabad, Telangana-500073.",TOW can act on this to grow market share in Hyderabad.,https://purityprayag.com/purity-prayag-organic-grocery-store-at-s-r-nagar-hyderabad/,2026-04-16T21:09:59
132,threat,"Plum Market, organic grocery store, opens in Palm Beach Gardens","Plum Market, an organic grocery store, officially opened Thursday, March 26, in the Prosperity Centre Plaza, on the corner of Prosperity Farms Road and PGA Boulevard. The Palm Beach Gardens location is only the second Plum Market in Florida, with the other in Aventura.",TOW should monitor and build defensive positioning against this.,https://www.yahoo.com/news/slideshows/plum-market-organic-grocery-store-194236285.html,2026-04-17T00:13:29
133,threat,Find and save ideas about organic grocery store ideas on Pinterest.,"Discover Pinterest’s best ideas and inspiration for Organic grocery store ideas. Get inspired and try out new things. Last updated 21h.MOM's Organic Market | Organic market, Grocery store design, Organic groceries.",TOW should monitor and build defensive positioning against this.,https://www.pinterest.com/ideas/organic-grocery-store-ideas/910325243295/,2026-04-17T00:13:29
134,customer_pain_point,theaffordableorganicstore.com Reviews | Read Customer Service ...Register a Consumer Complaint with National Consumer He,"This technology is designed to identify and remove content that breaches our guidelines, including reviews that are not based on a genuine experience. We recognise we may not catch everything, and you can flag anything you think we may have missed. This service enables consumers to lodge complaints against goods or services through the National Consumer Helpline portal. By registering an account, users can formally report issues and have their grievances addressed by relevant authorities, promot",TOW can differentiate by directly solving this pain point.,https://www.trustpilot.com/review/theaffordableorganicstore.com,2026-04-17T00:14:03
135,customer_pain_point,StarBazaar Best Grocery Home Delivery Supermarket in Hyderabad,"Star Bazaar is the modern retailer & one stop solution for for fresh food & groceries. Experience a wide range of daily essentials, poultry from your favorite grocery supermarket in Hyderabad, Bangalore, Mumbai, etc.",TOW can differentiate by directly solving this pain point.,https://starbazaarindia.com/,2026-04-17T00:14:13
136,customer_pain_point,"DoorDash: Food, Grocery and Retail - Fast Same Day Delivery","Get grocery and convenience store essentials. Grocery delivery, exactly how you want it.Shop from home and fill your cart with fresh produce, frozen entrees, deli delights and more.",TOW can differentiate by directly solving this pain point.,https://www.doordash.com/,2026-04-17T00:14:13
137,threat,THE ORGANIC SUPERMART Franchise | India's 1st Organic Supermarket,"The Organic Supermart is an international brand & it started its journey in 2014 with retail sales of Certified Organic Food, Organic Grocery, Organic spices, Organic Vegetables, Organic Eggs, Organic Chickens, Organic Ready to eat products, Organic Beauty Products & Garments Etc. The Organic Supermart is a one-stop supermarket chain that aims to offer customers a wide range of Chemical Free ...",TOW should monitor and build defensive positioning against this.,https://www.theorganicsupermart.com/franchise-opportunity/,2026-04-17T00:15:41
138,opportunity,Millets and Organic Farming: Unlocking Sustainable Growth and...,"Explore how India's green revolution, driven by millets and organic farming, offers sustainable growth and vast opportunities for entrepreneurs.",TOW can act on this to grow market share in Hyderabad.,https://hmsaconsultancy.com/millets-organic-farming-sustainable-growth/,2026-04-17T00:16:34
139,opportunity,India begins exports of organic millets grown in... - Smart Food,"“Millets are unique agricultural products from India which have signi cant demand in the global market. We will continue to carry out export promotion for the millets with a special focus on products sourced from the Himalayas,” M Angamuthu, Chairman, APEDA, was quoted by the website.",TOW can act on this to grow market share in Hyderabad.,https://www.smartfood.org/project/india-begins-exports-of-organic-millets-grown-in-himalayas-to-denmark/,2026-04-17T00:16:34
140,opportunity,India exports organic millets grown in... - The HinduBusinessLine,"“Millets are unique agricultural products from India which have significant demand in the global market. We will continue to carry out export promotion for the millets with a special focus on products sourced from Himalayas,” said M Angamuthu, Chairman, APEDA.",TOW can act on this to grow market share in Hyderabad.,https://www.thehindubusinessline.com/economy/agri-business/india-exports-organic-millets-grown-in-himalayas-to-denmark/article34492407.ece,2026-04-17T00:16:34
141,opportunity,Organics & Millets e-Platform,"Bengaluru, the organic & millet hub of India with over 400 exclusive organic & millet outlets, more than 400 corporate retail outlets and around 20 exclusive organic/millet restaurants. Important crops under organic cultivation.",TOW can act on this to grow market share in Hyderabad.,https://organics-millets.in/,2026-04-17T00:16:34
142,opportunity,From Farm to Table: The Journey of Organic Millets,"Organic millets are cultivated without the use of synthetic pesticides, herbicides, or fertilizers, prioritizing soil health, biodiversity, and ecological balance.",TOW can act on this to grow market share in Hyderabad.,https://jeevanshouse.com/from-farm-to-table-the-journey-of-organic-millets/,2026-04-17T00:16:34
143,threat,This bootstrapped startup is having a field day with its... | YourStory,"Hyderabad-based GoFarmz delivers fresh, naturally grown veggies and fruits to consumers within 24 hours of harvest; the startup wants to be a complete marketplace for organic produce across India.",TOW should monitor and build defensive positioning against this.,https://yourstory.com/2019/04/gofarmz-bootstrapped-organic-produce-startup,2026-04-17T00:51:29
144,threat,Amazon.com : 24 Mantara 24 Mantra Organic Masoor Dal - 2 Lb...,"Top highlights. Brand. 24 Mantra Organic. Item Weight. 32.5 Ounces.EU Organic production is an overall system of farm management and food production that combines environmental practices, the preservation of natural resources and the application of animal welfare standards.",TOW should monitor and build defensive positioning against this.,https://www.amazon.com/Organic-Split-Red-Lentils-Masoor/dp/B008NXMEV4,2026-04-17T00:53:54
145,threat,24 Mantra Organic Whole Wheat Atta Price - Buy Online at ₹328 in India,"Get items delivered to your doorstep from dark stores near you, whenever you need them. Best Prices & Offers.20% OFF. 24 Mantra Organic Premium Whole Wheat Atta. 1 kg.",TOW should monitor and build defensive positioning against this.,https://blinkit.com/prn/24-mantra-organic-whole-wheat-atta/prid/21491,2026-04-17T00:53:54
146,threat,24 mantra ORGANIC Organic Ragi Flour/Finger Millet/Nachni Flour...,Brand. 24 mantra ORGANIC. Type. Millet Flour.Organic. Yes. Used For. Cooking. Model Name. Organic Ragi Flour/Finger Millet/Nachni Flour. Nutrient Content.,TOW should monitor and build defensive positioning against this.,https://www.flipkart.com/24-mantra-organic-ragi-flour-finger-millet-nachni-flour/p/itmda2c6145eee30,2026-04-17T00:53:54
147,opportunity,"India Millets Market, Growth Forecast, Strategic Roadmap 2030","Simultaneously, the expansion of organic millet farming is expected to accelerate, driven by increasing consumer demand for organic products and supportive government incentives.",TOW can act on this to grow market share in Hyderabad.,https://www.kenresearch.com/industry-reports/india-millets-market,2026-04-17T00:54:40
148,opportunity,Nature’s Try – Millet & Organic Foods Packaging Design System,"A premium packaging design system for a modern FMCG brand, transforming traditional Indian millets and organic products into a contemporary, shelf-ready experience.",TOW can act on this to grow market share in Hyderabad.,https://www.awesomesauce.in/packaging-design/natures-try-millet-packaging-design,2026-04-17T00:55:14
149,threat,Grocery News,"The Organic World (TOW), a South Indian grocery retail chain and flagship brand of Nimida Group, has opened its first store in Hyderabad,͏͏ located ...",TOW should monitor and build defensive positioning against this.,https://snackfax.com/tag/grocery/,2026-04-17T15:42:15
150,threat,The Organic World expands to Hyderabad,"The organic retailer is also aiming to expand into key markets, including Bengaluru, Mysore, Pune, and various tier 2 and tier 3 cities throughout India. Founded in 2017, TOW currently operates 23 retail stores across Bengaluru and Hyderabad, offering nearly 3,000 products in the food, grocery, personal care and home care range.",TOW should monitor and build defensive positioning against this.,https://hyderabad.theorganicworld.com/news-details/15,2026-04-17T15:42:19
151,threat,'The Organic World' all set to add 30 New Stores In Hyderabad,"The Organic World (TOW), a known brand in responsible retailing and a part of the Bengaluru-based Nimida Group, is all set to add 30 new stores in Hyderabad, by the end of 2025. In September this year, TOW marked its foray out of Karnataka with the launch of its first store in Hyderabad in Pragathi Nagar.",TOW should monitor and build defensive positioning against this.,https://www.franchiseindia.com/insights/en/news/the-organic-world-all-set-to-add-30-new-stores-in-hyderabad.34837,2026-04-17T15:42:19
152,threat,Zama Organics Raises Undisclosed Amount In... | Entrepreneur,"The funds will be utilized to build the brand, expand footprint, improve technology and strength its network.Founded by Shriya Naheta Wadhwa, Zama Organics focuses on building a farm-to-table supply chain for organic and natural vegetables, fruits, groceries and artisanal food items.",TOW should monitor and build defensive positioning against this.,https://www.entrepreneur.com/en-in/finance/zama-organics-raises-undisclosed-amount-in-pre-series-a/416915,2026-04-17T15:42:23
153,threat,The Organic World Plans 30 New Stores in Hyderabad,"6th December 2024: The Organic World (TOW), India's No.1 Responsible Retailer and part of the Bengaluru-based Nimida Group, is targeting the addition of 30 new stores in Hyderabad, by the end of 2025. In September this year, TOW marked its foray out of Karnataka with the launch of its first store in Hyderabad in Pragathi",TOW should monitor and build defensive positioning against this.,https://businessnewsweek.in/business/the-organic-world-plans-30-new-stores-in-hyderabad/,2026-04-17T15:44:21
154,threat,Building Retail Tech Teams in India: Bengaluru vs Hyderabad vs Pune,"Retail tech teams are no longer an afterthought in international expansion. For global brands entering new markets, technology capability is increasingly built ahead of physical retail scale.",TOW should monitor and build defensive positioning against this.,https://yallo.co/insights/news/retail-tech-teams-india-bengaluru-hyderabad-pune/,2026-04-17T15:44:25
155,threat,‘Organic’ retailers are big on small outlets - The HinduBusinessLine,"The company will sell its brands across established retailers rather than expanding its own stores (it has just two outlets in Hyderabad). On the other hand, Delhi-based Organic Harvest is in a hurry to expand its retail presence with 50 outlets across India.",TOW should monitor and build defensive positioning against this.,https://www.thehindubusinessline.com/companies/‘Organic’-retailers-are-big-on-small-outlets/article20732097.ece,2026-04-17T15:44:25
156,threat,Belgium Foodtech Spotlight - Kazidomi and the New Retail Revolution...,"This week I do a deep dive into the case of Kazidomi, founded in 2016. Located in Brussels, this subscriptions-based online store offers organic products ranging from food to cosmetics and household items, with a focus on quality, ethics, and fast delivery.",TOW should monitor and build defensive positioning against this.,https://www.linkedin.com/pulse/belgium-foodtech-spotlight-kazidomi-new-retail-how-brussels-oarxe,2026-04-17T15:44:25
157,threat,ITC’s 24 Mantra deal and organic foods... - Trade Tricks by The Ken,"Decode the most significant shifts in business, technology, startups, and healthcare.The Ken has proven naysayers wrong by successfully running a digital news publication on a pure-subscription business model in India.",TOW should monitor and build defensive positioning against this.,https://the-ken.com/tradetricks/itcs-24-mantra-deal-and-organic-foods-unending-wait-for-glory/,2026-04-17T15:44:25
158,customer_pain_point,"Organic takeover: How 10,000 farmers of Telangana, Andhra are...","This is what nearly 10,000 farmers of Telangana and Andhra Pradesh have realised over the past decade and are now steering a silent organic movement.Stores in Hyderabad and Secunderabad sell online as well. Their vans still operate in Hyderabad.",TOW can differentiate by directly solving this pain point.,https://www.downtoearth.org.in/agriculture/organic-takeover-how-10-000-farmers-of-telangana-andhra-are-steering-a-silent-movement-84503,2026-04-17T15:44:50
159,customer_pain_point,The Affordable Organic Store Takes the Lead in... | Republic News India,"Hyderabad, (Telangana), [India], November 12, 2024: The Affordable Organic Store is taking Hyderabad by storm with its monthly plantation drives, inspiring locals to reconnect with nature and contribute to reforestation.",TOW can differentiate by directly solving this pain point.,https://republicnewsindia.com/the-affordable-organic-store-takes-the-lead-in-green-living-with-monthly-plantation-drives-in-hyderabad/,2026-04-17T15:44:50
160,customer_pain_point,Affordable Organic Store - Warehouse Packing Asistance,"Affordable Organic Store, Hyderabad.. invites applications for Warehouse Packing Asistance Posts. Post DetailsDuration: 3 months. Stipend: 8000-10,000 per month. Job location: Hyderabad. Application Mode: Through Online.",TOW can differentiate by directly solving this pain point.,https://pratibha.eenadu.net/notifications/notification_article/internship/affordable-organic-store-warehouse-packing-asist/1-8-288-23070009872,2026-04-17T15:44:50
