id,intel_type,subject,detail,strategic_implication,source,timestamp
161,customer_pain_point,"Iceberg Organic Icecreams, Kukatpally, Hyderabad | Zomato","Iceberg Organic Icecreams Hyderabad, Kukatpally; View reviews, menu, contact, location, and more for Iceberg Organic Icecreams Restaurant.",TOW can differentiate by directly solving this pain point.,https://www.zomato.com/hyderabad/iceberg-organic-icecreams-kukatpally,2026-04-17T15:44:50
162,opportunity,"PDF Consumer perceptions, preferences, and impediments to millet ...","Amid global millet promotion, this research advocates for innovative, accessible products and policy measures to integrate millets into Indian diets, addressing nutritional and sustainability challenges. Keywords: Foxtail millet adoption, consumer awareness, millet consumption patterns, nutritional security, Kadapa district (Andhra Pradesh)",TOW can act on this to grow market share in Hyderabad.,https://www.thepharmajournal.com/archives/2025/vol14issue8/PartA/14-7-62-122.pdf,2026-04-17T15:45:13
163,opportunity,Buy Organic Millets Online in India - Unpolished Millets – Natureland...,Choose from a variety of unpolished millets that are gluten-free and sourced from certified organic farms across India. Enjoy the health benefits of organic unpolished millets.,TOW can act on this to grow market share in Hyderabad.,https://naturelandorganics.com/collections/organic-millets,2026-04-17T15:45:17
164,opportunity,Special Story On Modati Mudda Hotel In Hyderabad | Millets Organic...,About Press Copyright Contact us Creators Advertise Developers Terms Privacy Policy & Safety How...,TOW can act on this to grow market share in Hyderabad.,https://www.youtube.com/watch?v=3ksgiD35MPw,2026-04-17T15:45:17
165,opportunity,"Indian Agriculture Sector, Farming in India | IBEF","Discover the growth, & innovations of Indian agriculture industry.To make India a global hub for 'Shree Anna', the Indian Institute of Millet Research, Hyderabad will be supported as the Centre of Excellence for sharing best practices, research, and technologies at the international level.",TOW can act on this to grow market share in Hyderabad.,https://www.ibef.org/industry/agriculture-india,2026-04-17T15:45:17
166,threat,24 Mantra Organic Bajra Flour Price - Buy Online at ₹75 in India,"24 Mantra Bajra Flour (Pearl Millet) is rich in minerals, vitamins and insoluble fibre. This brown flour is used for making flatbreads featuring a coarse texture and a sweet aftertaste. They pair well with leafy vegetables and this combination is very popular among Punjabis.",TOW should monitor and build defensive positioning against this.,https://blinkit.com/prn/24-mantra-organic-bajra-flour/prid/5755,2026-04-17T15:46:36
167,threat,Shop Online | Authentic Indian Spices & Groceries 24 Mantra Organic...,"Despite popular belief, organic farms do use pesticides. One of the primary benefits of eating organic is lower levels of pesticides. However,The difference is that they only use naturally-derived pesticides, rather than the synthetic pesticides used on conventional commercial farms.",TOW should monitor and build defensive positioning against this.,https://www.ekirana.nl/blog/post/24mantra-organic-indian-groceries,2026-04-17T15:46:36
168,threat,24 Mantra Organic Chakralu – Oooooya Goodness Store,"24 Mantra Organic Millet Chakralu is a Indian traditional ready to eat snack. It is made of millets, pulses and healthy fats. It is an ideal evening tea time snack.",TOW should monitor and build defensive positioning against this.,https://oooooya.com/products/24-mantra-organic-chakralu,2026-04-17T15:46:36
169,threat,"40 countries, 2,500 farmers, 1 aim: how Organic India... | YourStory","Organic India’s retail journey began in 1999 with general stores and modern trade distribution, which to date remains the primary channel of distribution. In the early 2000s, it retailed through Fabindia stores and in 2005 entered the ecommerce space to reach a larger customer base.",TOW should monitor and build defensive positioning against this.,https://yourstory.com/smbstory/organic-india-d2c-brand-farmers-covid-19-health-wellness-bharat-mitra-bhavani-lev,2026-04-17T15:46:41
170,threat,"Food & Beverage Products Startups in Hyderabad, India","Food & Beverage Products startups in Hyderabad, India There are 411 Food & Beverage Products startups in Hyderabad, India which include Sid's Farm, Dodla Dairy, Heritage Foods, Manam Chocolate, 24 Mantra. Out of these, 49 startup s are funded, with 18 having secured Series A+ funding.",TOW should monitor and build defensive positioning against this.,https://tracxn.com/d/explore/food-beverage-products-startups-in-hyderabad-india/__yXi3L-2x0Ic_B9IbuPnhB2KBb-Ce07xeIRDPflVaA9I/companies,2026-04-18T11:57:50
171,threat,82 Hyderabad Based Food and Beverage Companies - Best Startup,"Top Food and Beverage Companies & Startups (Hyderabad) 24 Mantra Organic 24 Mantra Organic is a specialty food shop for farmers' livelihood, customers a sustainable lifestyle, and a sustainable planet. Founder (s): Rajashekar Reddy Seelam Location: Hyderabad, Andhra Pradesh, India",TOW should monitor and build defensive positioning against this.,https://beststartup.in/82-hyderabad-based-food-and-beverage-companies-the-most-innovative-food-and-beverage-companies/,2026-04-18T11:57:50
172,threat,"Two Brothers Organic Farms, a startup that sells A2 Cultured Ghee and ...","Founded by 4th gen farmers, Ajinkya and Satyajit Hange, Two Brothers Organic Farms is focused on revolutionising the food industry with its commitment to nutrient-dense, chemical-free food grown through regenerative farming methods. The startup offers 100+ products such as the A2 Cultured Ghee, Khapli Atta and Cold-pressed Oils.",TOW should monitor and build defensive positioning against this.,https://indianstartupnews.com/funding/two-brothers-organic-farms-a-startup-that-sells-a2-cultured-ghee-and-100-other-products-raises-rs-110-crore-10572806,2026-04-18T11:57:50
173,threat,A Millet-Based Food Business Seeking Funds in Hyderabad,"It's a women-led start up built to help the co-millennial with a ""Millety Wholesome Meal"" .Hyderabad has emerged as a leading health-conscious market with increasing demand for natural, gluten-free, diabetic-friendly, and sustainable food options.",TOW should monitor and build defensive positioning against this.,https://businessdeals.in/a-millet-based-food-business-seeking-funds-in-hyderabad,2026-04-18T11:57:50
174,customer_pain_point,"The Affordable Organic Store, Bowenpally, Hyderabad - Justdial","The Affordable Organic Store in Bowenpally,Hyderabad listed under Organic Product Dealers in Hyderabad. Rated 3.8 based on 4283 Customer Reviews and Ratings with 72 Photos. Visit Justdial for Address, Contact Number, Reviews & Ratings, Photos, Maps of The Affordable Organic Store, Bowenpally, Hyderabad.",TOW can differentiate by directly solving this pain point.,https://www.justdial.com/Hyderabad/The-Affordable-Organic-Store-Bowenpally/040PXX40-XX40-221004073949-D8F4_BZDET,2026-04-18T11:58:13
175,threat,GUGU LOURIE: Has Mr Price taken too long to use retail science?,Acquisitive and organic growth can enable Mr Price to grow its use of retail science across the new African footprint. Retail science uses sophisticated technology methods and analytical tools to grow revenue and profit more effectively over the long run.,TOW should monitor and build defensive positioning against this.,https://www.businessday.co.za/bd/opinion/columnists/2022-07-13-gugu-lourie-has-mr-price-taken-too-long-to-use-retail-science/,2026-04-18T11:59:54
176,threat,"24 Mantra Organic Farm Shop, Hyderabad - Organic Safflower Oil and ...","About Us 24 Mantra Organic Farm Shop - Trader of organic safflower oil & other products in Hyderabad, Telangana.",TOW should monitor and build defensive positioning against this.,https://www.indiamart.com/24-mantra/,2026-04-18T12:00:08
177,threat,"Albertsons Under Pressure: Price Wars with Walmart, Amazon and...","Price competition is intensifying. Costs remain elevated. Consumer behaviour is shifting rapidly.The message from the market is clear: in today’s grocery war, survival depends on scale, speed, and price leadership.",TOW should monitor and build defensive positioning against this.,https://internationalsupermarketnews.com/albertsons-under-pressure-price-wars-with-walmart-amazon-and-kroger-expose-structural-weakness/,2026-04-18T12:00:12
178,opportunity,Adrish Zerowaste Organic Store - Madhapur (Hyderabad),"About the Business Adrish Zerowaste Organic Store - Madhapur (Hyderabad) is listed in RectoPages under the category Organic Food Store and located in Hyderabad. Our contact details are 073311 88448 and our address is 100f, Madhapur Rd.",TOW can act on this to grow market share in Hyderabad.,https://www.rectopages.com/adrish-zerowaste-organic-store-madhapur-hyderabad-0vox5xc2wqk6,2026-04-18T12:01:13
179,threat,Retail India News: Gravity Bath Enters Mumbai with... - Indian Retailer,The new Hyderabad launch is part of a broader retail expansion roadmap that aims to serve a growing consumer base seeking performance-led clothing.,TOW should monitor and build defensive positioning against this.,https://www.indianretailer.com/news/retail-india-news-gravity-bath-enters-mumbai-retail-format-bathware-consumers,2026-04-20T16:21:42
180,threat,Hyderabad Influencers – Cityi Influencers Telangana,"Retail case study. Retail Launch – Hyderabad. Footfall up 2.3x in just 10 days with strategic campaigns using Reels, Shorts, and top city-based Influencers in Hyderabad. Fintech installs.",TOW should monitor and build defensive positioning against this.,https://cityinfluencers.in/influencers-in-hyderabad/,2026-04-20T16:21:42
181,threat,Fortunate Organic Dairy | LinkedIn,"Retail Groceries. Hyderabad, Telangana. 6seasons Organic. Manufacturing. HYDERABAD, TELANGANA. Orion Spa & Wellness.",TOW should monitor and build defensive positioning against this.,https://in.linkedin.com/company/fortunate-organic-dairy,2026-04-20T16:21:42
182,threat,"Best Organic Food Brands in India, Top 10 Organic Food Company",24 Mantra is a Hyderabad-based organic food brand topping our list of best organic food brands in India; successfully providing Indians with the best ...,TOW should monitor and build defensive positioning against this.,https://yehaindia.com/top-organic-food-brands-available-in-your-city/,2026-04-20T16:23:55
183,threat,"Nature's Basket Coupon Codes, Offers & Deals Jun 2025","Nature ’ s Basket offers upto 30% discount ... Select from various brands such as Organic India, Gaia, 24 Mantra Organic, Get Natures Best etc.",TOW should monitor and build defensive positioning against this.,https://www.couponzeta.in/naturesbasket-coupons,2026-04-20T16:23:55
184,threat,Organic Food in Hyderabad - Latest Price & Mandi Rates from ...India Food Prices Dashboard | Daily Retail Food Price Tra,"Find here details of companies selling Organic Food in Hyderabad, Telangana. Get latest info on Organic Food, suppliers, wholesale suppliers, retailers & traders with Organic Food prices for buying. Track daily retail food prices across India with IndiaSpend’s interactive dashboard. Compare prices of essential commodities like onions, wheat, rice, pulses, and vegetables across states and cities. The Organic World, India's largest organic and natural groceries retailer, is planting the seeds of a",TOW should monitor and build defensive positioning against this.,https://dir.indiamart.com/hyderabad/organic-food.html,2026-04-20T16:24:02
185,threat,The Organic World: Sprouting a Greener Future with 100 Stores ...,"The Organic World, India's largest organic and natural groceries retailer, is planting the seeds of a healthier future, aiming to bloom into a network of 100 stores by the end of 2025.",TOW should monitor and build defensive positioning against this.,https://www.indianretailer.com/article/retail-business/retail/organic-world-sprouting-greener-future-100-stores-2025,2026-04-20T16:24:02
186,opportunity,Dr. M.L. Jat Inaugurates Agro-Mart for FPOs to Promote Millet... | ICAR,"27th April 2025, Hyderabad.Dr. Jat lauded ICAR-IIMR's contribution to rural development and millet promotion through farmer collectives, stating that the new Agro-Mart would enhance consumer access and visibility for FPOs, thereby improving farmer incomes.",TOW can act on this to grow market share in Hyderabad.,https://icar.org.in/en/dr-ml-jat-inaugurates-agro-mart-fpos-promote-millet-products-hyderabad,2026-04-20T16:24:30
187,opportunity,"Men and women mountaineering clothes, shoes & equipment - Millet","Freedom in practice, innovation, respect for our natural environment: MILLET is proud to meet the highest standards in terms of performance, comfort, and reliability with high-quality technical equipment and clothing suitable for mountain activities.",TOW can act on this to grow market share in Hyderabad.,https://www.millet.com/,2026-04-20T16:24:30
188,opportunity,ITC Acquisition: ITC Acquires 24 Mantra Organic to Boost Organic Food ...,"ITC has finalized its all-cash acquisition of Sresta Natural Bioproducts, the owner of '24 Mantra Organic brand', for Rs 472.50 crore. The deal, completed on June 13, 2025, includes an upfront ...",TOW can act on this to grow market share in Hyderabad.,https://brandequity.economictimes.indiatimes.com/news/business-of-brands/itc-acquires-24-mantra-organic-to-boost-organic-food-segment/121850853,2026-04-20T16:25:04
189,opportunity,ITC to buy 24 Mantra Organic for ₹472.5 crore to power its healthy ...,"""We are excited to have 24 Mantra Organic as part of ITC's Foods Business's portfolio of nutrition-led healthy foods products,"" said Hemant Malik, Wholetime Director, ITC Limited.",TOW can act on this to grow market share in Hyderabad.,https://www.businesstoday.in/latest/corporate/story/itc-to-buy-24-mantra-organic-for-rs4725-crore-to-power-its-healthy-foods-portfolio-472495-2025-04-17,2026-04-20T16:25:04
190,threat,The Organic World expands to Hyderabad - indiaretailing.com,"Founded in 2017, TOW currently operates 23 retail stores across Bengaluru and Hyderabad, offering nearly 3,000 products in the food, grocery, personal care and home care range.",TOW should monitor and build defensive positioning against this.,https://www.indiaretailing.com/2024/09/26/the-organic-world-expands-to-hyderabad,2026-05-08T22:44:02
191,threat,The Organic World on LinkedIn: #theorganicworld #hyderabadlaunch # ...,"🌱 The Organic World expands to Hyderabad! 🌱 📢 We're excited to announce the opening of our very first store outside Karnataka, in the bustling city of…",TOW should monitor and build defensive positioning against this.,https://www.linkedin.com/posts/the-organic-world_theorganicworld-hyderabadlaunch-panindiaexpansion-activity-7240659723425828864-HFoC,2026-05-08T22:44:02
192,threat,{Funding Alert} Rosier Foods Secures Capital to... - Indian Retailer,"D2C food brand Millwize has announced its expansion into key metro markets, including Delhi NCR, Mumbai, Pune, Bengaluru, Chennai, and Hyderabad. The move marks a step in strengthening its retail and consumer outreach across urban India.",TOW should monitor and build defensive positioning against this.,https://www.indianretailer.com/news/funding-alertrosier-foods-secures-capital-scale-farm-table-food-business,2026-05-08T22:44:14
193,customer_pain_point,Bid to clean up a rotten trail in Hyderabad's thriving food scene,"Hyderabad's food scene faces a crackdown on adulteration and unsafe practices, aiming to restore consumer trust and safety.",TOW can differentiate by directly solving this pain point.,https://www.thehindu.com/news/national/telangana/bid-to-clean-up-a-rotten-trail-in-hyderabads-thriving-food-scene/article70844574.ece,2026-05-08T22:44:46
194,customer_pain_point,Online Grocery Shopping and Online Supermarket in India - bigbasket,The best online grocery store in India. bigbasket is an online supermarket for all your daily needs. Online shopping now made easy with a wide range of groceries and home needs.,TOW can differentiate by directly solving this pain point.,https://www.bigbasket.com/,2026-05-08T22:44:46
195,threat,Live Organic’s 40% Growth: Loyalty-First Grocery App - Kringle AI,"With a premium organic range and a loyal customer base, Live Organic saw an opportunity to deepen engagement through a subscription-first model—rewarding consistency, making reordering easier and creating a deeper bond with its loyal buyers.",TOW should monitor and build defensive positioning against this.,https://kringle.ai/insights/live-organic-subscription-grocery,2026-05-08T22:46:59
196,threat,India Loyalty Programs Market Intelligence 2025: Cross ...Satvik Organic Case Study | Organic Grocery Mobile AppLoyalty ,"Feb 13, 2025 · In India, there is a growing preference for digital-first, mobile-based loyalty programs, which are gaining popularity across various sectors. Companies are moving away from traditional... Satvik Organic is a leading organic food retail store offering a wide range of natural alternatives in groceries, raw foods, personal care, home care, healthcare, and nutritional supplements from major brands in the organic space. Sep 24, 2025 · Explore the best loyalty programs in India and pro",TOW should monitor and build defensive positioning against this.,https://www.businesswire.com/news/home/20250213552919/en/India-Loyalty-Programs-Market-Intelligence-2025-Cross-Industry-and-Cross-Brand-Loyalty-Partnerships-Competitive-Landscape-Data-Analytics-for-Personalization---Future-Growth-Dynamics-to-2029---ResearchAndMarkets.com,2026-05-08T22:46:59
197,threat,Hyper-Local AI: How Bhashini Empowers Hyderabad Kirana Stores,"The “Voice-First” Revolution in Hyderabad Retail. Hyderabad has always been a city of dialects and diverse commerce. In 2026, the integration of Bhashini AI for small business has turned a smartphone into a powerful universal translator.",TOW should monitor and build defensive positioning against this.,https://metropolitanindia.com/tech-digital-transformation/bhashini-ai-hyderabad-kirana-stores-global-reach/,2026-05-08T22:47:03
198,threat,Buy 24 Mantra products online at the Lowest Prices- Instamart,"Get your 24 Mantra organic foods delivered swiftly and hassle-free in Hyderabad. Experience the convenience of 24 Mantra online delivery straight to your doorstep, ensuring you always have fresh and healthy options available.",TOW should monitor and build defensive positioning against this.,https://www.swiggy.com/instamart/city/hyderabad/b/24-mantra,2026-05-08T22:47:17
199,threat,Amazon.in: 24 Mantra Organic: Amazon Fresh,"24 Mantra Organic Brown Sugar 1 Kg | Organically Processed from Freshly Squeezed Sugarcane, 100% Organic & 0% Chemicals | Certified Organic & Naturally Gluten Free",TOW should monitor and build defensive positioning against this.,"https://www.amazon.in/Amazon-Fresh-24-Mantra-Organic/s?rh=n:16392737031,p_89:24+Mantra+Organic",2026-05-08T22:47:17
200,threat,24 Mantra Organic Deals Discounts Stores | Organic Food ...,"24 Mantra Organic is the largest Indian organic food brand in India. It has over 200 products internationally certified sold in the US and international markets. Switch to organic food, pesticide free meat, chicken, breakfast, vegetables today. Check out 24 Mantra deals, discounts & Coupons.",TOW should monitor and build defensive positioning against this.,https://www.upto75.com/24-mantra-organic-food-discount-offers,2026-05-08T22:47:17
201,threat,24 Mantra Organic - Facebook,"Sep 22, 2025 · 💫Lip-smacking, clean snacking starts here: 🥜 Organic Peanuts 🌿 Organic Sesame 🍯 Organic Jaggery Peanut Chikki & Sesame Chikki Made with pure ingredients, zero chemicals & pesticides and 100% festive goodness! Celebrate the joy of tradition with a crunch that’s as wholesome as it is delicious. 💚",TOW should monitor and build defensive positioning against this.,https://www.facebook.com/24MantraOrganic/,2026-05-08T22:47:17
202,threat,Availability and Affordability of Organic and Natural Foods ...,"3 days ago · India needs sustainable food systems, but there is low demand for organic and natural foods. A survey of urban retailers across India, Brazil & the UK found affordably priced options scarce, pointing to the need for a multi-stakeholder approach to building assured markets for sustainable produce.",TOW should monitor and build defensive positioning against this.,https://www.theindiaforum.in/economy/availability-and-affordability-organic-and-natural-foods-indian-retail-shops,2026-05-08T22:47:26
203,threat,Quick commerce crisis: How Amazon and Flipkart’s 23% price ...,"Dec 31, 2025 · Jefferies’ latest study reveals a sharp price war brewing in India’s online grocery market and Blinkit isn’t the cheapest anymore.",TOW should monitor and build defensive positioning against this.,https://www.financialexpress.com/business/industry/quick-commerce-crisis-how-amazon-and-flipkarts-23-price-war-is-shaking-blinkit-zeptonbsp/4086240/,2026-05-08T22:47:26
204,threat,The Grocery Price War You Didn’t Mean to Start,From Unintended Price War to Disciplined Competition. Grocery pricing will always involve competitor pressure. The difference is whether pressure triggers targeted action or uncontrolled cascades. Competitor Analysis Software for Retail...,TOW should monitor and build defensive positioning against this.,https://hypersonix.ai/blogs/the-grocery-price-war-you-didnt-mean-to-start,2026-05-08T22:47:26
205,opportunity,"Organic takeover: How 10,000 farmers of Telangana... - Vikalp Sangam","The federation buys cereals, millets, pulses, vegetables and oilseeds at 10 per cent higher prices, which can increase based on quality. For paddy, rates can go higher. The federation sells raw and processed products, which include food items, cosmetics and other non-food products.",TOW can act on this to grow market share in Hyderabad.,https://vikalpsangam.org/article/organic-takeover-how-10000-farmers-of-telangana-andhra-are-steering-a-silent-movement/,2026-05-08T22:48:09
206,opportunity,Sangam Dukanams selling organic millets are creating their own...,"HYDERABAD: In order to bring organic millets closer to consumers, the Deccan Development Society (DDS) has established Sangam Dukanams in rural areas across the State to offer organically cultivated millets by tribal and marginalised women farmers.",TOW can act on this to grow market share in Hyderabad.,https://www.newindianexpress.com/good-news/2023/Jul/09/sangam-dukanams-selling-organic-millets-are-creating-their-own-niche-in-telangana-2592914.html,2026-05-08T22:48:09
207,opportunity,Millets Compendium_29112023,"The application of organic amendments such as farmyard manure ensures supply of all major nutrients and micronutrients necessary for plant growth. FYM improves physical, chemical, and biological properties of the soil.Millet Farming. Location: Hyderabad, Telangana, India.",TOW can act on this to grow market share in Hyderabad.,https://www.niti.gov.in/sites/default/files/2024-01/Millet+CompendiumM_1.pdf,2026-05-08T22:48:09
208,opportunity,Millets Market by Applications: Sweden | Norway | Denmark | Finland,"Belgium Millets Market Key Highlights. Increasing import volumesâ€”Belgium imports a significant portion of millet to meet domestic demand, especially organic varieties from Eastern Europe and Asia.",TOW can act on this to grow market share in Hyderabad.,https://www.linkedin.com/pulse/millets-market-applications-sweden-norway-denmark-o8t1f,2026-05-08T22:48:09
209,opportunity,Organic & Millets Expo inaugurated at Ameerpet | Business India Focus,"Hyderabad, March 15, 2019: The five day Organic & Millets Expo and Bazar was inaugurated at Kamma Sangham in Ameerpet by Ms. Madhavai, Managing Director of BigMarketeer.",TOW can act on this to grow market share in Hyderabad.,https://www.biftoday.com/post/organic-millets-expo-inaugurated-at-ameerpet,2026-05-08T22:48:09
210,opportunity,Naked Groceries: Startup Creates Zero-Waste Store,"A package-free, zero-waste grocery store where customers bring their own, reusable containers to fill with local and organic goods? It sounds like a dream for environmentalists, but it’s a real-life business venture for brothers and co-founders Christian and Joseph Lane.",TOW can act on this to grow market share in Hyderabad.,https://www.cnbc.com/2012/02/28/naked-groceries-startup-creates-zerowaste-store.html,2026-05-08T22:48:36
211,opportunity,"Dr. Shweta B. Karadipatil, 2025, 13:5 An Open Access Journal ...","Comparative Study on Green and Sustainable Practices in Indian Agri-Businesses: A Case Analysis of EcoFarms India, Sresta (24 Mantra Organic), and WayCool Foods",TOW can act on this to grow market share in Hyderabad.,https://www.ijset.in/wp-content/uploads/IJSET_V13_issue5_152.pdf,2026-05-08T22:48:43
