id,intel_type,subject,detail,strategic_implication,source,timestamp
1,threat,Hyderabad's new organic store champions sustainable living,"Hyderabad's new organic store The Conscious Living Store, replicates Tula India's philosophy and offers organic groceries and handmade clothing. Launching August 1.",TOW should monitor and build defensive positioning against this.,https://www.thehindu.com/life-and-style/hyderabads-new-organic-store-champions-sustainable-living/article69868778.ece,2026-04-16T12:02:30
2,threat,"The Organic World to add 30 new stores in Hyderabad, plans for 2-hour ...","The Organic World, part of the Bengaluru-based Nimida Group, is targeting the addition of 30 new stores in Hyderabad, by the end of 2025. In September this year, it marked its foray out of Karnataka with the launch of its first store in Hyderabad in Pragathi Nagar. This targeted expansion marks a ...",TOW should monitor and build defensive positioning against this.,https://www.fnbnews.com/Top-News/the-organic-world-to-add-30-new-stores-in-hyderabad-plans-for-2hour-delivery-service-to-drive-convenience--quick-commerce-80305,2026-04-16T12:02:30
3,threat,The Organic World plans to add 30 new stores in Hyderabad,"India's leading natural and organic groceries retailer, The Organic World, has shifted towards an omnichannel approach with their new expansion plans. Part of the Bengaluru-based Nimida Group, TOW is planning to open 30 new stores in Hyderabad, by the end of 2025.",TOW should monitor and build defensive positioning against this.,https://www.retail4growth.com/news/the-organic-world-plans-to-add-30-new-stores-in-hyderabad-7021,2026-04-16T12:02:30
4,threat,The Organic World to Add 30 New Stores in Hyderabad,"The Organic World (TOW), India's No.1 Responsible Retailer and part of the Bengaluru-based Nimida Group, is targeting the addition of 30 new stores in Hyderabad, by the end of 2025. In September this year, TOW marked its foray out of Karnataka with the launch of its first store in Hyderabad in Pragathi Nagar.",TOW should monitor and build defensive positioning against this.,https://www.businessoffood.in/the-organic-world-to-add-30-new-stores-in-hyderabad/,2026-04-16T12:02:30
5,threat,"India's leading natural and organic groceries retailer, The Organic ...","The Organic World (TOW), India's No.1 Responsible Retailer and part of the Bengaluru-based Nimida Group, is targeting the addition of 30 new stores in Hyderabad, by the end of 2025.",TOW should monitor and build defensive positioning against this.,https://www.5dariyanews.com/news/445240-Indias-leading-natural-and-organic-groceries-retailer-The-Organic-World-to-add-30-new-stores-in-H,2026-04-16T12:02:30
6,threat,Ratnadeep Retail Pvt. Ltd - Grocery Stores and Supermarket in Hyderabad ...,"Ratnadeep Retail Hyperlocal Supermarket with over 60 stores across Hyderabad and Bengaluru . Find Grocery, Food Items, Provision Stores, Household Products, Dairy Products at Supermarket ratnadeepretail.com",TOW should monitor and build defensive positioning against this.,https://ratnadeep.com/,2026-04-16T12:02:30
7,threat,Hyderabad Central - Wikipedia,"The mall was launched in November 2004 when the owners, Pantaloon Retail (India) Limited , at the same time also announced plans to create 12 to 15 ...",TOW should monitor and build defensive positioning against this.,https://en.wikipedia.org/wiki/Hyderabad_Central,2026-04-16T12:02:35
8,threat,Hyderabad-based Marri Retail Limited files DRHP for IPO |,... retail business as a proprietorship under the brand name ‘Jeans Corner’ in 1999 and entered the large-format retail segment by launching the first ...,TOW should monitor and build defensive positioning against this.,https://globalprimenews.com/2026/02/02/hyderabad-based-marri-retail-limited-files-drhp-for-ipo/,2026-04-16T12:02:35
9,threat,Akshayakalpa Organic Raises ₹350 Crore for Expansion,"Akshayakalpa is proving that ethical food systems can scale, and that India’s next food revolution can uplift both the consumer and the farmer.",TOW should monitor and build defensive positioning against this.,https://www.linkedin.com/posts/startupveda_akshayakalpa-organicfood-dairyinnovation-activity-7403350058781327360-cjSt,2026-04-16T12:02:41
10,threat,A91 Partners Leads $12M Funding for Akshayakalpa Growth,"Jan 11, 2024 · Established by GNS Reddy and Shashi Kumar, Akshayakalpa boasts of supplying organic milk and associated products to over 60,000 consumers daily in Bengaluru, Hyderabad, and Chennai through its direct delivery platform.",TOW should monitor and build defensive positioning against this.,https://startuparticle.com/food/2024/01/akshayakalpa-organic-secures-rs-100-crore-in-series-c-funding-led-by-a91-partners/,2026-04-16T12:02:41
11,threat,Organic Dairy Valued at $180M: Akshayakalpa’s Rs 350 Cr Round,"Nov 19, 2025 · Akshayakalpa has earmarked the substantial primary capital for aggressive geographical and product expansion. The company, which currently services Bengaluru, Chennai, and Hyderabad, is actively setting up operations to launch in two major new markets: Mumbai and Pune.",TOW should monitor and build defensive positioning against this.,https://in.edairynews.com/organic-dairy-valued-at-180m-akshayakalpas-rs-350-cr-round/,2026-04-16T12:02:41
12,threat,Akshayakalpa Organic to raise $15 million in Series B funding ...,"Akshayakalpa plans to aggressively invest in Bengaluru, Chennai, and Hyderabad markets, expand into new geographies of Pune, Mumbai and Kochi and take its long-shelf organic dairy products pan India.",TOW should monitor and build defensive positioning against this.,https://www.siliconindia.com/startup/startup-funding/akshayakalpa-organic-to-raise-15-million-in-series-b-funding-round-nwid-34505.html,2026-04-16T12:02:41
13,threat,{Funding Alert} ECOIL Plans India Expansion After... - Indian Retailer,"As part of its expansion strategy, the startup plans to enter Delhi in April and is preparing to expand into Hyderabad in the next financial year. It has also partnered with platforms such as BigBasket and Flipkart Minutes, with plans to onboard Amazon India going forward.",TOW should monitor and build defensive positioning against this.,https://www.indianretailer.com/news/funding-alert-ecoil-plans-india-expansion-after-raising-25-mn-series-round,2026-04-16T12:02:41
14,customer_pain_point,The Affordable Organic Store Reviews | File a Complaint,"Consumer reviews, complaints and opinions about The Affordable Organic Store. Share your experience, submit a complaint, contact The Affordable Organic Store directly",TOW can differentiate by directly solving this pain point.,https://www.consumercomplaints.in/bycompany/the-affordable-organic-store-a640918.html,2026-04-16T12:03:01
15,customer_pain_point,Praakritik Launches Delivery of Organic Fruits and Vegetables,"After witnessing a successful response to our organic grocery products, we expanded our offerings to fresh organic fruits and vegetables in ...",TOW can differentiate by directly solving this pain point.,https://www.indianretailer.com/news/praakritik-launches-delivery-organic-fruits-and-vegetables-bangalore,2026-04-16T12:03:13
16,customer_pain_point,10 Best Grocery Delivery Mobile Apps in India for 2025,"In 2025 , the Indian grocery delivery industry has witnessed remarkable growth, driven by urbanization , changing consumer behaviors, and the ...",TOW can differentiate by directly solving this pain point.,https://www.goteso.com/blog/10-best-grocery-delivery-mobile-apps-in-india/,2026-04-16T12:03:13
17,opportunity,Millet wave not a passing trend — It is a structural shift,"Startups like Slurrp Farm, Millet Amma, and Tata Soull, alongside legacy FMCG giants like ITC, Britannia, and Patanjali, are creating a vibrant product pipeline. The Millet Udyami Bharath 2025 event in Hyderabad trained 140 participants from 25 states in millet entrepreneurship, signalling a deepening of the value chain beyond metropolitan centres.",TOW can act on this to grow market share in Hyderabad.,https://www.fnbnews.com/Special-Reports/millet-wave-not-a-passing-trend--it-is-a-structural-shift-86456,2026-04-16T12:03:57
18,opportunity,(PDF) Behavioural and Socio-Economic Determinants of Consumer ...,"The study investigated the behavioural and socio-economic variables influencing consumer expenditure on organic millets in Hyderabad, India. As the demand for organic foods has grown ...",TOW can act on this to grow market share in Hyderabad.,https://www.researchgate.net/publication/396572058_Behavioural_and_Socio-Economic_Determinants_of_Consumer_Expenditure_on_Organic_Millets_Evidence_from_Hyderabad_India,2026-04-16T12:03:57
19,opportunity,"Millet Market Size, Share, Trends & Growth Forecast 2034","In July 2025, Sabala Millets launched its millet-based food products on Zepto in Hyderabad and Bengaluru, offering fast delivery in just 10 minutes. The brand's ready-to-cook range includes items like Multi Millet Pongal, Khichdi, and Bisibele Bhath, aiming to make nutritious meals convenient for urban families.",TOW can act on this to grow market share in Hyderabad.,https://www.imarcgroup.com/millet-market,2026-04-16T12:03:57
20,opportunity,PDF The Rise of Millets in India Evaluating Itc'S Fmcg Contribution and ...,"The study's scope focuses on assessing consumer perception and acceptance of ITC's branded millet products within the urban Indian FMCG market, evaluating their market potential and the influence of corporate and government efforts.",TOW can act on this to grow market share in Hyderabad.,https://tijer.org/tijer/papers/TIJER2507058.pdf,2026-04-16T12:03:57
21,opportunity,Millet Is Not a Trend Anymore. It Is a Category. And Indian ... - LinkedIn,"Sabala Millets launched on Zepto in Hyderabad and Bengaluru in July 2025, delivering multi-millet Pongal and Khichdi in ten minutes. When Britannia enters a category, it is not following a trend.",TOW can act on this to grow market share in Hyderabad.,https://www.linkedin.com/pulse/millet-trend-anymore-category-indian-brands-have-narrow-cinbc,2026-04-16T12:03:57
22,opportunity,"Millets Market Size, Growth, Trends and Forecast",... millets is experiencing robust growth due to rising ... The region s inclination towards organic and sustainable food sources propels millet demand.,TOW can act on this to grow market share in Hyderabad.,https://www.globalinsightservices.com/reports/millets-market/,2026-04-16T12:04:03
23,opportunity,Trend Analysis of the Changing Landscape in the Area and,"Millets, the earliest domesticated grains since the Indus ... Society for Millets Research, ICAR Indian Institute of Millets Research, Hyderabad, pp.",TOW can act on this to grow market share in Hyderabad.,https://arccjournals.com/journal/bhartiya-krishi-anusandhan-patrika/BKAP720,2026-04-16T12:04:03
24,threat,The Organic World expands to Hyderabad - businessoffood.in,Hyderabad has been strategically chosen for this expansion due to its cosmopolitan demographic. The city's growing awareness and acceptance of chemical-free products make it an ideal location for TOW's curated offerings. The current launch is in line with the company's aim to achieve a 100 crore OR 100 stores target by end of 2025.,TOW should monitor and build defensive positioning against this.,https://www.businessoffood.in/the-organic-world-expands-to-hyderabad/,2026-04-16T12:08:14
25,threat,The Organic World expands to Hyderabad - indiaretailing.com,"The current launch is in line with the company's aim to achieve a 100 crore or 100 stores target by end of 2025. ""Our Hyderabad store is only the first of many to come,"" said Gaurav ...",TOW should monitor and build defensive positioning against this.,https://www.indiaretailing.com/2024/09/26/the-organic-world-expands-to-hyderabad,2026-04-16T12:08:14
26,threat,Welcome To The Organic World,"Hindu Business Line: The Organic World eyes adding 30 stores in Hyderabad by 2025 end The Organic World (TOW), a D2C retail brand, plans to add 30 new stores in Hyderabad by the end of 2...",TOW should monitor and build defensive positioning against this.,https://theorganicworld.com/,2026-04-16T12:08:14
27,threat,This Hyderabad Startup Aims to Curb Restaurant Food Waste,"The food wastes we get from restaurants are indigestive. Our cooking involves oil, grease and spices. The challenge was whether we could use this food waste to convert it into organic manure and gas.",TOW should monitor and build defensive positioning against this.,https://www.restaurantindia.in/article/this-hyderabad-startup-aims-to-curb-restaurant-food-waste.13101,2026-04-16T12:08:18
28,threat,City based startup Timla Foods raises seed... - Start-Up Hyderabad,"Timla Food has raised this funding under their brand PopiCorn – which makes ready to eat popcorn. At Popicorn, they make great tasting wholesome snacks for every age and lifestyle. PopiCorn”s popcorn is ready to eat, 100% natural, GMO free and made of whole grain.",TOW should monitor and build defensive positioning against this.,https://startuphyderabad.com/city-based-startup-timla-foods-raises-seed-funding-kae-cap/,2026-04-16T12:08:18
29,customer_pain_point,This shop in Hyderabad is one-stop destination for organic food,"While there are many organic stores that promise to provide such natural products, one outlet that has managed to stand apart from others is the Bhagyanagaram Go Adharita Natural Farmers Producer Company Limited.",TOW can differentiate by directly solving this pain point.,https://telanganatoday.com/this-shop-in-hyderabad-is-one-stop-destination-for-organic-food,2026-04-16T12:08:37
30,customer_pain_point,"Healthy Grocery, Organic Food... | Sprouts Farmers Market","Our neighborhood grocery stores offer thousands of natural, organic & gluten-free foods. Discover fresh produce, meats, vitamins, supplements & more.",TOW can differentiate by directly solving this pain point.,https://www.sprouts.com/,2026-04-16T12:08:37
31,customer_pain_point,Growing Organic World Organically - SustainabilityNext,He signed up The Organic World with The International Competence Centre for Organic Agriculture (ICCOA) as its knowledge partner. ICCOA’s India centre is based in Bengaluru. It provides a platform for interaction to all stakeholders in the organic sector.,TOW can differentiate by directly solving this pain point.,https://sustainabilitynext.in/growing-organic-world-organically/,2026-04-16T12:08:44
32,customer_pain_point,Buy Certified Organics Online in Hyderabad: Instant Delivery,Order Certified Organics online in Hyderabad on Swiggy Instamart at the best prices and get it delivered to your doorstep in 10 minutes.,TOW can differentiate by directly solving this pain point.,https://www.swiggy.com/instamart/city/hyderabad/sc/fresh-vegetables/certified-organics-60d2cbaa8ac42c7f24024829?custom_back=true,2026-04-16T12:08:48
33,customer_pain_point,Pure Organic Zone Becomes Hyderabad's Trusted Platform for Organic ...,"HYDERABAD, India - Nov. 14, 2025 - PRLog -- Pure Organic Zone is emerging as one of Hyderabad's fastest-growing organic grocery and fresh meat delivery platforms, offering 100% natural and chemical-free products to customers across the city.",TOW can differentiate by directly solving this pain point.,https://www.prlog.org/13111017-pure-organic-zone-becomes-hyderabads-trusted-platform-for-organic-groceries-fresh-meat-delivery.html,2026-04-16T12:08:48
34,customer_pain_point,The Organic World to add 30 new stores in Hyderabad plans ... - LinkedIn,Food And Beverage News Food & Beverage News 6mo The Organic World to add 30 new stores in Hyderabad plans for 2 hour delivery service to drive convenience quick commerce https://lnkd.in/dqbVUSXs ...,TOW can differentiate by directly solving this pain point.,https://www.linkedin.com/posts/fnbnews_top-news-activity-7270409460471275521-KAOF,2026-04-16T12:08:48
35,opportunity,PDF Assessing Consumer Demand for Millets in India - TRIF,"Support will be provided for post-harvest value addition, enhancing domestic consumption and branding of millet products nationally and internationally"". Millets are small-grained, annual, warm-weather cereals belonging to the grass family. Jowar (Sorghum), Bajra (Pearl Millet) and Ragi (Finger millet) are the important millets cultivated in ...",TOW can act on this to grow market share in Hyderabad.,https://www.trif.in/wp-content/uploads/2024/05/Assessing-Consumer-Demand-for-Millets-in-India-Report.pdf,2026-04-16T12:09:30
36,opportunity,PDF ANNUAL REPORT - Indian Institute of Millets Research,"ed globally. ICAR- Indian Institute of Millets Research -Hyderabad will play a pivotal role in operating successful and sustainable millet value chain in other countries through millet fair-cum-exhibitions, capacity building, skill development and strengthening stakeholder linkages and linking farme",TOW can act on this to grow market share in Hyderabad.,https://www.millets.res.in/annual_report/ar22-23.pdf,2026-04-16T12:09:35
37,opportunity,"Millets Market Size & Share, Growth Forecasts Report 2025-2034",The millets market is experiencing an organic and non-organic competition millets each driven by unique demand and market forces. Ethical millets are gaining purchase attention among consumers concerned with health looking for green labels that are non-chemical and eco-friendly.,TOW can act on this to grow market share in Hyderabad.,https://www.gminsights.com/industry-analysis/millets-market,2026-04-16T12:09:35
38,opportunity,"India Millets Market (2024-2030) | Trends, Outlook & Forecast","India Millets Market Synopsis The millets market in India is projected to grow at a CAGR of 15.9% during the forecast period (2023-2029). Rising health consciousness among an increasing number of consumers, coupled with emerging trends such as gluten-free and vegan diets, are likely to drive the growth of the market. The growing demand for traditional foods like millet has encouraged numerous ...",TOW can act on this to grow market share in Hyderabad.,https://www.6wresearch.com/industry-report/india-millets-market,2026-04-16T12:09:35
39,opportunity,Millet Fest Hyderabad - MilletFest.com Food Exhibition Hitex Hyderabad ...,"MilletFest or Millets Exhibition at Hyderabad is an Annual Event. You can avail Natural Gluten Free Unpolished Millets, Millet Cookies, Millet Noodles, Similarly Nannari Natural organic soft drink is avaialble for sale (Both Regular & Sugar Free Flavours"" Food Receipe Vidoes This MILLETFEST focus to open up immense opportunities for start-ups and empower the supply chain as well, in these ...",TOW can act on this to grow market share in Hyderabad.,http://www.milletfest.com/,2026-04-16T12:09:35
40,opportunity,"The Millet Paradox: High Demand, Low Returns for Telangana Farmers","Despite rising consumer demand, millet farmers in Telangana face low profits and policy gaps. Explore the economic challenges, carbon credit potential, and urgent reforms needed to make millet cultivation sustainable.",TOW can act on this to grow market share in Hyderabad.,https://millets.news/updates/Toward-a-Resilient-Future-Making-Millets-Work-for-Farmers,2026-04-16T12:09:35
41,opportunity,A Study on Business Opportunity and Market Analysis of Npm Millets and ...,"ABSTRACT Health foods are gaining popularity among the consumers because of the scientific linkage between food intake and human health. The rise in demand for healthy foods globally is mainly due to the increase in the life style diseases like diabetes, obesity, cardio vascular diseases, and cancers and, in India too there is a similar trend. NPM pulses and millets have no pesticide residue ...",TOW can act on this to grow market share in Hyderabad.,https://krishikosh.egranth.ac.in/server/api/core/bitstreams/fb8f48a1-2908-48bc-860f-7e364e4e199f/content,2026-04-16T12:09:35
42,threat,TOW Aims To Add 30 New Stores In Hyderabad By 2025 - BW Retail,"... India, The Organic World (TOW), a natural and organic groceries retailer, is targeting the addition of 30 new stores in Hyderabad by the end of 2025 ...",TOW should monitor and build defensive positioning against this.,https://bwretailworld.com/companies/tow-aims-to-add-30-new-stores-in-hyderabad-by-2025,2026-04-16T12:22:56
43,threat,Best Grocery Franchise Investments in India for 2024 - AMPM,"With the increasing urbanization of Indian cities and the shift towards organized retail, grocery store like Ampm Store are well-positioned to meet ...",TOW should monitor and build defensive positioning against this.,https://ampmstore.in/best-grocery-franchise-investments-in-india-for-2024/,2026-04-16T12:22:56
44,threat,"The Organic World Sets Ambitious Goal of 100 Stores by 2025,","The company aims to open 100 new stores by the year 2025, signaling a significant leap forward in its mission to make organic products more ...",TOW should monitor and build defensive positioning against this.,https://businesssaga.in/the-organic-world-sets-ambitious-goal-of-100-stores-by-2025-transforming-the-landscape-of-organic-grocery-retail/,2026-04-16T12:22:56
45,threat,hyderabad – dailyplanetpost,... grocery high how hyderabad ideas india investment kerala known list long low make management manufacturing marketing markets money most much mumbai ...,TOW should monitor and build defensive positioning against this.,https://dailyplanetpost.com/tag/hyderabad/,2026-04-16T12:22:56
46,threat,"organic, grocery, store, near - Sell & Buy Free Classified Ads","More Health & Beauty Ads - grocery store near me , food mart near me open now Looking for the best grocery store near me in Sri Ganganagar? Look no ...",TOW should monitor and build defensive positioning against this.,https://www.kugli.com/Sell_Buy/search/organic_grocery_store_near_me/,2026-04-16T12:22:56
47,threat,Two Brothers Organic Farms to use ₹110 crore funding to ... - CNBCTV18,"The fresh capital will help Two Brothers Organic Farms strengthen its farmer partnerships, build a large-scale food park, and expand its retail presence across key international markets, including the US, Middle East, and UK.",TOW should monitor and build defensive positioning against this.,https://www.cnbctv18.com/business/startup/two-brothers-organic-farms-funding-farmer-network-global-footprint-expansion-19715886.htm,2026-04-16T12:23:05
48,customer_pain_point,File a Consumer Complaint Against The Affordable Organic Store - Voxya,"Want to file a consumer complaint against The Affordable Organic Store? Learn how to file a complaint, what to expect, and how to get resolution for your issue. Get started today.",TOW can differentiate by directly solving this pain point.,https://voxya.com/company/the-affordable-organic-store-complaints/1225428,2026-04-16T12:23:27
49,customer_pain_point,The Affordable Organic Store - Indian Consumer Complaints Forum,Consumer complaints and reviews about The Affordable Organic Store - Damaged product are being delivered and not refunded.. The Affordable Organic Store contact information and services description.,TOW can differentiate by directly solving this pain point.,https://www.consumercomplaints.in/the-affordable-organic-store-damaged-product-are-being-delivered-and-not-refunded-c3352324,2026-04-16T12:23:27
50,threat,Live Organic's 40% Growth: Loyalty-First Grocery App - Kringle AI,Live Organic redefined healthy shopping in Delhi NCR with a subscription-based organic grocery model and seamless mobile-first rewards.,TOW should monitor and build defensive positioning against this.,https://kringle.ai/insights/live-organic-subscription-grocery,2026-04-16T12:25:00
51,threat,Our Plans & Pricing - TheFruitCircle Hyderabad,"Explore TheFruitCircle's flexible subscription plans in Hyderabad. Choose from Basic, Premium, or create a Custom fruit box. Fresh organic fruits, veggies, dry fruits, and sprouts delivered.",TOW should monitor and build defensive positioning against this.,https://thefruitcircle.in/pricing,2026-04-16T12:25:04
52,threat,Subscription Model - Organic Tap,"At Organic Tap, we're your gateway to farm-fresh goodness, delivering organic vegetables, fruits, and groceries directly from farmers to your doorstep. Indulge in the crispness of sustainably farmed, chemical-free produce, curated from a wide network of organic and natural farmers.",TOW should monitor and build defensive positioning against this.,https://organictap.in/pages/subscription,2026-04-16T12:25:04
53,threat,Farm-Fresh Food Business with Tech & Subscription Model,"India's demand for clean, healthy, and locally sourced food is rising rapidly, especially among urban families. uniquely positioned to scale this demand with its tech-driven, vendor-powered model. Market Opportunity: India's organic & natural food market is projected to grow at 20%+ CAGR Rising awareness about chemical-free produce and traditional cooking essentials Increasing adoption of ...",TOW should monitor and build defensive positioning against this.,https://businessdeals.in/farm-fresh-food-business-with-tech-subscription-model,2026-04-16T12:25:04
54,threat,SM-46: Reinventing Organic Retail: Sahaja Aharam's Farmer ... - LinkedIn,"From a consumer initiative to a farmer-owned chain (2009 onward) Sahaja Aharam's story began in 2009, when a group of Hyderabad consumers formed a cooperative to source chemical-free food ...",TOW should monitor and build defensive positioning against this.,https://www.linkedin.com/pulse/sm-46-reinventing-organic-retail-sahaja-aharams-farmer-owned-g-v-uwkze/,2026-04-16T12:25:04
